{
 "version": 1,
 "source": "IEarnSolo/boat-upgrades @ 0c0978b (BSD-2)",
 "parts": [
  {
   "key": "Base",
   "name": "Base",
   "kind": "core",
   "benefit": "Hitpoints, defences and speed of the raft.",
   "raftExcluded": false
  },
  {
   "key": "Hull",
   "name": "Hull",
   "kind": "core",
   "benefit": "Hitpoints, defences and speed of the boat.",
   "raftExcluded": false
  },
  {
   "key": "Helm",
   "name": "Helm",
   "kind": "core",
   "benefit": "Navigation; higher tiers resist stronger rapids.",
   "raftExcluded": false
  },
  {
   "key": "Sails",
   "name": "Mast & sails",
   "kind": "core",
   "benefit": "Speed; trim every 30 seconds for a boost and Sailing xp.",
   "raftExcluded": false
  },
  {
   "key": "Keel",
   "name": "Keel",
   "kind": "core",
   "benefit": "Armour and hitpoints; adamant+ opens crystal-flecked waters.",
   "raftExcluded": false
  },
  {
   "key": "Cargo Hold",
   "name": "Cargo hold",
   "kind": "facility",
   "benefit": "Stores cargo and salvage while sailing.",
   "raftExcluded": false
  },
  {
   "key": "Salvaging Hook",
   "name": "Salvaging hook",
   "kind": "facility",
   "benefit": "Salvage shipwrecks while sailing for xp and salvage.",
   "raftExcluded": false
  },
  {
   "key": "Cannon",
   "name": "Cannon",
   "kind": "facility",
   "benefit": "Boat combat; fires cannonballs up to its own tier.",
   "raftExcluded": false
  },
  {
   "key": "Teleport Focus",
   "name": "Teleport focus",
   "kind": "facility",
   "benefit": "Lets Summon Boat teleport the boat to your dock or mooring.",
   "raftExcluded": false
  },
  {
   "key": "Wind Device",
   "name": "Wind catcher",
   "kind": "facility",
   "benefit": "Stores wind motes; release for a speed boost at sea.",
   "raftExcluded": false
  },
  {
   "key": "Trawling Net",
   "name": "Trawling net",
   "kind": "facility",
   "benefit": "Used for deep-sea trawling.",
   "raftExcluded": true
  },
  {
   "key": "Chum Station",
   "name": "Chum station",
   "kind": "facility",
   "benefit": "Baits shoals while deep-sea trawling.",
   "raftExcluded": true
  },
  {
   "key": "Fathom Device",
   "name": "Fathom stone",
   "kind": "facility",
   "benefit": "Locates shoals while deep-sea trawling.",
   "raftExcluded": true
  },
  {
   "key": "Range",
   "name": "Range",
   "kind": "facility",
   "benefit": "Cook food at sea.",
   "raftExcluded": false
  },
  {
   "key": "Keg",
   "name": "Keg",
   "kind": "facility",
   "benefit": "Stores ales rewarded from sea charting.",
   "raftExcluded": false
  },
  {
   "key": "Anchor",
   "name": "Anchor",
   "kind": "facility",
   "benefit": "Holds the boat in place at sea.",
   "raftExcluded": true
  },
  {
   "key": "Inoculation Station",
   "name": "Inoculation station",
   "kind": "facility",
   "benefit": "Safely traverse the Shrouded Ocean's fetid waters.",
   "raftExcluded": true
  },
  {
   "key": "Salvaging Station",
   "name": "Salvaging station",
   "kind": "facility",
   "benefit": "Sort salvage on board.",
   "raftExcluded": true
  },
  {
   "key": "Crystal Extractor",
   "name": "Crystal extractor",
   "kind": "facility",
   "benefit": "Generates wind motes for the wind/gale catcher.",
   "raftExcluded": true
  },
  {
   "key": "Eternal Brazier",
   "name": "Eternal brazier",
   "kind": "facility",
   "benefit": "Safely traverse the icy Northern Ocean.",
   "raftExcluded": false
  }
 ],
 "upgrades": [
  {
   "id": "base_b0_t0",
   "part": "Base",
   "boatType": 0,
   "tier": 0,
   "name": "Wooden base",
   "page": "Wooden base",
   "sailing": 1,
   "construction": 1,
   "reqs": [],
   "schematic": null,
   "materials": [
    {
     "name": "Logs",
     "itemId": 1511,
     "qty": 10
    },
    {
     "name": "Rope",
     "itemId": 954,
     "qty": 6
    },
    {
     "name": "Swamp tar",
     "itemId": 1939,
     "qty": 10
    }
   ]
  },
  {
   "id": "hull_b1_t0",
   "part": "Hull",
   "boatType": 1,
   "tier": 0,
   "name": "Wooden hull",
   "page": "Wooden hull",
   "sailing": 1,
   "construction": 1,
   "reqs": [],
   "schematic": null,
   "materials": [
    {
     "name": "Wooden hull parts",
     "itemId": 32041,
     "qty": 10
    },
    {
     "name": "Bronze nails",
     "itemId": 4819,
     "qty": 300
    },
    {
     "name": "Swamp tar",
     "itemId": 1939,
     "qty": 20
    }
   ]
  },
  {
   "id": "hull_b2_t0",
   "part": "Hull",
   "boatType": 2,
   "tier": 0,
   "name": "Wooden hull",
   "page": "Wooden hull",
   "sailing": 1,
   "construction": 1,
   "reqs": [],
   "schematic": null,
   "materials": [
    {
     "name": "Large wooden hull parts",
     "itemId": 32062,
     "qty": 16
    },
    {
     "name": "Bronze nails",
     "itemId": 4819,
     "qty": 600
    },
    {
     "name": "Swamp tar",
     "itemId": 1939,
     "qty": 25
    }
   ]
  },
  {
   "id": "helm_b0_t0",
   "part": "Helm",
   "boatType": 0,
   "tier": 0,
   "name": "Bronze helm",
   "page": "Bronze helm",
   "sailing": 1,
   "construction": 1,
   "reqs": [],
   "schematic": null,
   "materials": [
    {
     "name": "Plank",
     "itemId": 960,
     "qty": 2
    },
    {
     "name": "Bronze bar",
     "itemId": 2349,
     "qty": 4
    }
   ]
  },
  {
   "id": "helm_b1_t0",
   "part": "Helm",
   "boatType": 1,
   "tier": 0,
   "name": "Bronze helm",
   "page": "Bronze helm",
   "sailing": 1,
   "construction": 1,
   "reqs": [],
   "schematic": null,
   "materials": [
    {
     "name": "Plank",
     "itemId": 960,
     "qty": 3
    },
    {
     "name": "Bronze bar",
     "itemId": 2349,
     "qty": 6
    }
   ]
  },
  {
   "id": "helm_b2_t0",
   "part": "Helm",
   "boatType": 2,
   "tier": 0,
   "name": "Bronze helm",
   "page": "Bronze helm",
   "sailing": 1,
   "construction": 1,
   "reqs": [],
   "schematic": null,
   "materials": [
    {
     "name": "Plank",
     "itemId": 960,
     "qty": 4
    },
    {
     "name": "Bronze bar",
     "itemId": 2349,
     "qty": 8
    }
   ]
  },
  {
   "id": "sails_b0_t0",
   "part": "Sails",
   "boatType": 0,
   "tier": 0,
   "name": "Wooden mast & linen sails",
   "page": "Wooden mast and linen sails",
   "sailing": 1,
   "construction": 1,
   "reqs": [],
   "schematic": null,
   "materials": [
    {
     "name": "Logs",
     "itemId": 1511,
     "qty": 5
    },
    {
     "name": "Bronze nails",
     "itemId": 4819,
     "qty": 20
    },
    {
     "name": "Bolt of linen",
     "itemId": 31472,
     "qty": 5
    }
   ]
  },
  {
   "id": "sails_b1_t0",
   "part": "Sails",
   "boatType": 1,
   "tier": 0,
   "name": "Wooden mast & linen sails",
   "page": "Wooden mast and linen sails",
   "sailing": 1,
   "construction": 1,
   "reqs": [],
   "schematic": null,
   "materials": [
    {
     "name": "Logs",
     "itemId": 1511,
     "qty": 10
    },
    {
     "name": "Bronze nails",
     "itemId": 4819,
     "qty": 40
    },
    {
     "name": "Bolt of linen",
     "itemId": 31472,
     "qty": 5
    }
   ]
  },
  {
   "id": "sails_b2_t0",
   "part": "Sails",
   "boatType": 2,
   "tier": 0,
   "name": "Wooden mast & linen sails",
   "page": "Wooden mast and linen sails",
   "sailing": 1,
   "construction": 1,
   "reqs": [],
   "schematic": null,
   "materials": [
    {
     "name": "Logs",
     "itemId": 1511,
     "qty": 15
    },
    {
     "name": "Bronze nails",
     "itemId": 4819,
     "qty": 60
    },
    {
     "name": "Bolt of linen",
     "itemId": 31472,
     "qty": 10
    }
   ]
  },
  {
   "id": "keel_b1_t0",
   "part": "Keel",
   "boatType": 1,
   "tier": 0,
   "name": "Bronze keel",
   "page": "Bronze keel",
   "sailing": 1,
   "construction": 1,
   "reqs": [],
   "schematic": null,
   "materials": [
    {
     "name": "Bronze keel parts",
     "itemId": 31999,
     "qty": 10
    }
   ]
  },
  {
   "id": "keel_b2_t0",
   "part": "Keel",
   "boatType": 2,
   "tier": 0,
   "name": "Bronze keel",
   "page": "Bronze keel",
   "sailing": 1,
   "construction": 1,
   "reqs": [],
   "schematic": null,
   "materials": [
    {
     "name": "Large bronze keel parts",
     "itemId": 32020,
     "qty": 16
    }
   ]
  },
  {
   "id": "helm_b0_t1",
   "part": "Helm",
   "boatType": 0,
   "tier": 1,
   "name": "Iron helm",
   "page": "Iron helm",
   "sailing": 17,
   "construction": 14,
   "reqs": [
    "skillb:Sailing:17",
    "skillb:Construction:14"
   ],
   "schematic": null,
   "materials": [
    {
     "name": "Oak plank",
     "itemId": 8778,
     "qty": 2
    },
    {
     "name": "Iron bar",
     "itemId": 2351,
     "qty": 4
    }
   ]
  },
  {
   "id": "helm_b1_t1",
   "part": "Helm",
   "boatType": 1,
   "tier": 1,
   "name": "Iron helm",
   "page": "Iron helm",
   "sailing": 17,
   "construction": 14,
   "reqs": [
    "skillb:Sailing:17",
    "skillb:Construction:14"
   ],
   "schematic": null,
   "materials": [
    {
     "name": "Oak plank",
     "itemId": 8778,
     "qty": 3
    },
    {
     "name": "Iron bar",
     "itemId": 2351,
     "qty": 6
    }
   ]
  },
  {
   "id": "helm_b2_t1",
   "part": "Helm",
   "boatType": 2,
   "tier": 1,
   "name": "Iron helm",
   "page": "Iron helm",
   "sailing": 17,
   "construction": 14,
   "reqs": [
    "skillb:Sailing:17",
    "skillb:Construction:14"
   ],
   "schematic": null,
   "materials": [
    {
     "name": "Oak plank",
     "itemId": 8778,
     "qty": 4
    },
    {
     "name": "Iron bar",
     "itemId": 2351,
     "qty": 8
    }
   ]
  },
  {
   "id": "base_b0_t1",
   "part": "Base",
   "boatType": 0,
   "tier": 1,
   "name": "Oak base",
   "page": "Oak base",
   "sailing": 20,
   "construction": 8,
   "reqs": [
    "skillb:Sailing:20",
    "skillb:Construction:8"
   ],
   "schematic": null,
   "materials": [
    {
     "name": "Oak logs",
     "itemId": 1521,
     "qty": 10
    },
    {
     "name": "Rope",
     "itemId": 954,
     "qty": 6
    },
    {
     "name": "Swamp tar",
     "itemId": 1939,
     "qty": 10
    }
   ]
  },
  {
   "id": "hull_b1_t1",
   "part": "Hull",
   "boatType": 1,
   "tier": 1,
   "name": "Oak hull",
   "page": "Oak hull",
   "sailing": 20,